ref_pmid,ref_is_clinical_trial_pt_type,ref_publication_types,ref_primary_nct_number,ref_primary_nct_source,ref_all_registry_ids,ref_all_nct_numbers,ref_all_structured_nct_numbers,ref_all_nct_source_pairs,ref_all_structured_nct_source_pairs,ref_has_abstract,ref_abstract,ref_fetch_status
11335738,False,"Journal Article;Research Support, Non-U.S. Gov't",,,,,,,,True,"The national Neonatal Resuscitation Program (NRP), started in 1987, provided training to hospital delivery room personnel to standardize knowledge and skills to reduce neonatal morbidity and mortality and increase successful resuscitation during the first few critical minutes after birth. The Apgar score continues to be used as the best established index of immediate postnatal health. The purpose of this study was to evaluate the impact of the NRP instruction in Illinois hospitals by examining Apgar scores among high-risk infants who are likely to benefit from the NRP. A retrospective 3-time period cohort design was used (before the introduction of the NRP, 1985-1988; transition when NRP training occurred, 1989-1990; and after NRP training was completed at least once for some delivery room personnel in each Illinois hospital, 1991-1995). Illinois computerized birth certificate files on a selected group of 636 429 high-risk neonates provided information on Apgar scores and maternal characteristics. The American Academy of Pediatrics provided instructor lists to determine when NRP training started and when it was fully implemented in Illinois. Illinois Department of Public Health provided data to categorize hospitals into levels based on type and intensity of neonatal services (Level I, II, II+, III). High-risk neonates were defined as meeting 1 of the following criteria: maternal age <20 years old or >35 years old, birth weight <2500 g or >4000 g, presence of a maternal medical risk factor, and no prenatal care or prenatal care started after the first trimester. Several exclusion criteria were applied including the following: birth records with missing data, multiple birth or congenital anomaly, and hospital information that indicate no birth deliveries in 1 of the 11 study years or delivery outside of a hospital. One-minute and 5-minute Apgar scores were divided into categories for analysis (0-3, 4-6, 7-10). No change or a decrease in a low (0-6) 1-minute Apgar when compared with the 5-minute Apgar was a primary measure to evaluate effect of NRP resuscitation. Variables examined included the following: race/ethnicity, maternal age, level of education, presence of maternal medical risk factor, trimester started prenatal care, complications of labor and delivery, and a low birth weight. Analysis consisted of chi(2) tests, relative risk calculations, and logistic regression to reveal independent associations with no change in low 1-minute Apgar score or continued low (0-6) 5-minute Apgar. A total of 636 429 high-risk birth records was selected for detailed analyses out of 2 077 533 births in Illinois between 1985 and 1995 for 193 hospitals. The number of active NRP instructors in Illinois changed dramatically during the study period; for example, 1 to 6 between 1987 and 1988 to 1096 to 1242 between 1991 and 1995. The percentage of neonates reported to have low (<7) 1-minute Apgar score decreased in 1991 to 1995 overall and for each of 4 hospital levels. Overall and by hospital level, there was a statistically significant lower proportion of high-risk newborns who showed a decrease or no change in their 5-minute Apgar scores after the NRP instruction. After adjusting for several maternal characteristics, logistic regression analysis revealed that high-risk newborns with a low 1-minute Apgar were more likely to increase their 5-minute Apgar after the NRP instruction in 1991 to 1995. Additional analyses indicated that very low birth weight and low birth weight newborns benefited the most from NRP instruction. Although previous research has shown that the NRP instruction improves knowledge and skill among health care personnel in the delivery room, both short-term and long-term, there has been little evidence to demonstrate NRP impact on infant morbidity. Several strategies were used in this study to control for bias and to adjust for secular trends in decreased infant morbidity during the study period. This study demonstrated sufficient support for the hypothesis that a significant improvement occurred among neonates in their Apgar score after the NRP instruction in Illinois. Empirical support is provided for the clinical effectiveness of NRP instruction.",success
21391876,True,Journal Article;Randomized Controlled Trial,,,,,,,,True,"To investigate the effects of delayed cord clamping (DCC) on peripheral hematopoietic progenitor cells (HPCs) and hematological parameters in premature infants (<32 weeks) during the neonatal period. This was a prospective, randomized, and controlled, single-center study. Prior to delivery, 21 infants were randomly assigned to immediate cord clamping (ICC) at 5-10 s and 21 infants to DCC at 30-45 s. One milliliter blood sample was taken in the first 30 min of life. HPCs were measured by three-color flow cytometry using monoclonal antibodies. There were no significant differences between groups in either maternal or neonatal demographics. All HPC counts were higher in the ICC group, but the difference was not significant. CD34+ cell counts were 45.3 ± 36.6/μL in the ICC and 33.2 ± 26.6/μL in the DCC group (P=0.33); multi-potent progenitor cell counts were 43.2 ± 35/μL in the ICC and 31.1 ± 26.6/μL in the DCC group (P=0.28); and hematopoietic stem cell counts were 2.1 ± 2.1/μL in the ICC and 2.1 ± 3.1/μL in the DCC group (P=0.66). Contrary to our expectation, all HPC counts were lower in the DCC group.",success
9323618,True,Clinical Trial;Comparative Study;Journal Article;Randomized Controlled Trial,,,,,,,,True,"To assess: (i) the size of placental transfusion following a 30 s delay in cord clamping following vaginal and Caesarean births; and (ii) the feasibility of delaying cord clamping in the labour ward and particularly in the operating theatre. Fourty-six infants born at 26-33 weeks gestation were randomized to having the umbilical cord clamped either immediately or 30 s after birth. The venous haematocrit was measured at 1 and at 4 h of age. There were trends towards higher mean haematocrits in the infants following delayed clamping, but these were not significant either at 1 h (55 +/- 7.7 vs 52.9 +/- 7) or at 4 h of age (55 +/- 7 vs 52.5 +/- 7). The trends were more marked in the infants born by Caesarean section, and in those born at 26-29 weeks gestation. A 30 s delay in cord clamping is feasible at both vaginal and Caesarean births, but does not lead to the predicted difference in infant haematocrit. Although physiological studies suggest that a placental transfusion of 15-20 mL/kg occurs within 30 s of delivery, these data suggest that future trials should either delay cord clamping for more than 30 s, or should alter the position of the infant in relation to the uterus in order to facilitate the transfusion. Delayed cord clamping is feasible at Caesarean section.",success
21448208,True,"Journal Article;Randomized Controlled Trial;Research Support, N.I.H., Extramural",,,,,,,,True,"Delayed cord clamping (DCC) may be beneficial in very-preterm and very-low-birth-weight infants. This study was a randomized unmasked controlled trial. It was performed at three centers of the NICHD (National Institute of Child Health and Human Development) Neonatal Research Network. DCC in very-preterm and very-low-birth-weight infants will result in an increase in hematocrit levels at 4 h of age. Infants with a gestational age of 24 to 28 weeks were randomized to either early cord clamping (<10 s) or DCC (30 to 45 s). The primary outcome was venous hematocrit at 4 h of age. Secondary outcomes included delivery room management, selected neonatal morbidities and the need for blood transfusion during the infants' hospital stay. A total of 33 infants were randomized: 17 to the immediate cord clamping group (cord clamped at 7.9±5.2 s, mean±s.d.) and 16 to the DCC (cord clamped at 35.2±10.1 s) group. Hematocrit was higher in the DCC group (45±8% vs 40±5%, P<0.05). The frequency of events during delivery room resuscitation was almost identical between the two groups. There was no difference in the hourly mean arterial blood pressure during the first 12 h of life; there was a trend in the difference in the incidence of selected neonatal morbidities, hematocrit at 2, 4 and 6 weeks, as well as the need for transfusion, but none of the differences was statistically significant. A higher hematocrit is achieved by DCC in very-low-birth-weight infants, suggesting effective placental transfusion.",success
11039135,True,Clinical Trial;Journal Article;Randomized Controlled Trial,,,,,,,,True,"This study was carried out to assess the feasibility of late cord clamping of 45 s in preterm infants delivered mainly by caesarean section and the effects on postpartal adaptation and anaemia of prematurity. Prior to delivery, 40 infants of < 33 gestational weeks were randomised to either 20 s or 45 s of late cord clamping. After the first shoulder was delivered, oxytocin was given intravenously to the mother in order to enhance placento-fetal transfusion while the infant was held below the level of the placenta. The 20 infants in group 1 (20 s) had a mean birth weight of 1070 g and a mean gestational age of 29 + 4/7 weeks versus 1190 g and 30 weeks in group 2 (45 s). On day 42 of life there were ten infants without transfusions in group 2 versus three in group 1 (P < 0.05). Out of the 20 infants in group 1, 19 and 15/19 in group 2 were delivered by caesarean section. There were no significant differences in Apgar scores, temperature on admission, heart rate, blood pressure and requirements for artificial ventilation. Delayed cord clamping of 45 s is feasible and safe in preterm infants below 33 weeks of gestation. It is possible to perform the procedure at caesarean section deliveries and it should be performed whenever possible. It reduces the need for packed red cell transfusions during the first 6 weeks of life.",success
30481760,True,"Journal Article;Randomized Controlled Trial;Research Support, Non-U.S. Gov't",,,,,,,,True,"Delayed cord clamping (DCC) improves placental transfusion and increases blood volume in preterm infants when compared with immediate cord clamping (ICC). However, evidence to support DCC in multiple-birth preterm infants is still lacking. To compare the outcomes of ICC versus DCC in preterm infants of multiple births. Women with a multiple pregnancy, including twins and triplets with a gestational age of 28-36 weeks, were randomized to receive ICC (23 women and 50 infants) or DCC for 30-60 s (24 and 51 infants). The infants' hematocrit on admission, superior vena cava (SVC) flow measured within 24 h, and hematocrit at 8 weeks of age were compared. The use of uterotonic agents during delivery was not controlled in this study. All infants were delivered by cesarean section (CS) except for 2 sets of twins, 1 in each group. Maternal and infant baseline characteristics in both groups were comparable. There were no significant differences between the groups in admission hematocrit, SVC flow measured within 24 h, hematocrit at 8 weeks of age, or any other neonatal outcomes. The incidence of maternal postpartum hemorrhage (PPH) was higher in the DCC group (4.3% in ICC vs. 25% in DCC, p = 0.04). DCC for 30-60 s did not improve placental transfusion or increase systemic blood flow in multiple-birth infants born preterm, mostly by CS, when compared with ICC. The finding of a higher PPH rate in the DCC group raises concerns about the maternal safety of this procedure in this patient population.",success
22895933,False,Journal Article;Meta-Analysis;Systematic Review,,,,,,,,True,"Optimal timing for clamping the umbilical cord at preterm birth is unclear. Early clamping allows for immediate transfer of the infant to the neonatologist. Delaying clamping allows blood flow between the placenta, the umbilical cord and the baby to continue. The blood which transfers to the baby between birth and cord clamping is called placental transfusion. Placental transfusion may improve circulating volume at birth, which may in turn improve outcome for preterm infants. To assess the short- and long-term effects of early rather than delaying clamping or milking of the umbilical cord for infants born at less than 37 completed weeks' gestation, and their mothers. We searched the Cochrane Pregnancy and Childbirth Group Trials Register (31 May 2011). We updated this search on 26 June 2012 and added the results to the awaiting classification section. Randomised controlled trials comparing early with delayed clamping of the umbilical cord and other strategies to influence placental transfusion for births before 37 completed weeks' gestation. Three review authors assessed eligibility and trial quality. Fifteen studies (738 infants) were eligible for inclusion. Participants were between 24 and 36 weeks' gestation at birth. The maximum delay in cord clamping was 180 seconds. Delaying cord clamping was associated with fewer infants requiring transfusions for anaemia (seven trials, 392 infants; risk ratio (RR) 0.61, 95% confidence interval (CI) 0.46 to 0.81), less intraventricular haemorrhage (ultrasound diagnosis all grades) 10 trials, 539 infants (RR 0.59, 95% CI 0.41 to 0.85) and lower risk for necrotising enterocolitis (five trials, 241 infants, RR 0.62, 95% CI 0.43 to 0.90) compared with immediate clamping. However, the peak bilirubin concentration was higher for infants allocated to delayed cord clamping compared with immediate clamping (seven trials, 320 infants, mean difference 15.01 mmol/L, 95% CI 5.62 to 24.40). For most other outcomes (including the primary outcomes infant death, severe (grade three to four) intraventricular haemorrhage and periventricular leukomalacia) there were no clear differences identified between groups; but for many there was incomplete reporting and wide CIs. Outcome after discharge from hospital was reported for one small study; there were no significant differences between the groups in mean Bayley II scores at age seven months (corrected for gestation at birth (58 children)).No studies reported outcomes for the women. Providing additional placental blood to the preterm baby by either delaying cord clamping for 30 to 120 seconds, rather than early clamping, seems to be associated with less need for transfusion, better circulatory stability, less intraventricular haemorrhage (all grades) and lower risk for necrotising enterocolitis. However, there were insufficient data for reliable conclusions about the comparative effects on any of the primary outcomes for this review.",success
29097178,False,"Journal Article;Meta-Analysis;Research Support, Non-U.S. Gov't;Systematic Review",,,,,,,,True,"The effects of delayed cord clamping of the umbilical cord in preterm infants are unclear. We sought to compare the effects of delayed vs early cord clamping on hospital mortality (primary outcome) and morbidity in preterm infants using Cochrane Collaboration neonatal review group methodology. We searched MEDLINE, EMBASE, Cochrane Central Register of Controlled Trials, and Chinese articles, cross-referencing citations, expert informants, and trial registries to July 31, 2017, for randomized controlled trials of delayed (≥30 seconds) vs early (<30 seconds) clamping in infants born <37 weeks' gestation. Before searching the literature, we specified that trials estimated to have cord milking in >20% of infants in any arm would be ineligible. Two reviewers independently selected studies, assessed bias, and extracted data. Relative risk (ie, risk ratio), risk difference, and mean difference with 95% confidence intervals were assessed by fixed effects models, heterogeneity by I<sup>2</sup> statistics, and the quality of evidence by Grading of Recommendations, Assessment, Development, and Evaluations. Eighteen randomized controlled trials compared delayed vs early clamping in 2834 infants. Most infants allocated to have delayed clamping were assigned a delay of ≥60 seconds. Delayed clamping reduced hospital mortality (risk ratio, 0.68; 95% confidence interval, 0.52-0.90; risk difference, -0.03; 95% confidence interval, -0.05 to -0.01; P = .005; number needed to benefit, 33; 95% confidence interval, 20-100; Grading of Recommendations, Assessment, Development, and Evaluations = high, with I<sup>2</sup> = 0 indicating no heterogeneity). In 3 trials in 996 infants ≤28 weeks' gestation, delayed clamping reduced hospital mortality (risk ratio, 0.70; 95% confidence interval, 0.51-0.95; risk difference, -0.05; 95% confidence interval, -0.09 to -0.01; P = .02, number needed to benefit, 20; 95% confidence interval, 11-100; I<sup>2</sup> = 0). In subgroup analyses, delayed clamping reduced the incidence of low Apgar score at 1 minute, but not at 5 minutes, and did not reduce the incidence of intubation for resuscitation, admission temperature, mechanical ventilation, intraventricular hemorrhage, brain injury, chronic lung disease, patent ductus arteriosus, necrotizing enterocolitis, late onset sepsis or retinopathy of prematurity. Delayed clamping increased peak hematocrit by 2.73 percentage points (95% confidence interval, 1.94-3.52; P < .00001) and reduced the proportion of infants having blood transfusion by 10% (95% confidence interval, 6-13%; P < .00001). Potential harms of delayed clamping included polycythemia and hyperbilirubinemia. This systematic review provides high-quality evidence that delayed clamping reduced hospital mortality, which supports current guidelines recommending delayed clamping in preterm infants. This review does not evaluate cord milking, which may also be of benefit. Analyses of individual patient data in these and other randomized controlled trials will be critically important in reliably evaluating important secondary outcomes.",success
16567393,True,"Journal Article;Multicenter Study;Randomized Controlled Trial;Research Support, Non-U.S. Gov't",,,,,,,,True,"The umbilical cord is usually clamped immediately after birth. There is no sound evidence to support this approach, which might deprive the newborn of some benefits such as an increase in iron storage. We sought to determine the effect of timing of cord clamping on neonatal venous hematocrit and clinical outcome in term newborns and maternal postpartum hemorrhage. This was a randomized, controlled trial performed in 2 obstetrical units in Argentina on neonates born at term without complications to mothers with uneventful pregnancies. After written parental consents were obtained, newborns were randomly assigned to cord clamping within the first 15 seconds (group 1), at 1 minute (group 2), or at 3 minutes (group 3) after birth. The infants' venous hematocrit value was measured 6 hours after birth. Two hundred seventy-six newborns were recruited. Mean venous hematocrit values at 6 hours of life were 53.5% (group 1), 57.0% (group 2), and 59.4% (group 3). Statistical analyses were performed, and results were equivalent among groups because the hematocrit increase in neonates with late clamping was within the prespecified physiologic range. The prevalence of hematocrit at <45% (anemia) was significantly lower in groups 2 and 3 than in group 1. The prevalence of hematocrit at >65% was similar in groups 1 and 2 (4.4% and 5.9%, respectively) but significantly higher in group 3 (14.1%) versus group 1 (4.4%). There were no significant differences in other neonatal outcomes and in maternal postpartum hemorrhage. Delayed cord clamping at birth increases neonatal mean venous hematocrit within a physiologic range. Neither significant differences nor harmful effects were observed among groups. Furthermore, this intervention seems to reduce the rate of neonatal anemia. This practice has been shown to be safe and should be implemented to increase neonatal iron storage at birth.",success
16782490,True,"Journal Article;Randomized Controlled Trial;Research Support, Non-U.S. Gov't",NCT00298051,databank,NCT00298051,NCT00298051,NCT00298051,NCT00298051|databank,NCT00298051|databank,True,"Delayed clamping of the umbilical cord increases the infant's iron endowment at birth and haemoglobin concentration at 2 months of age. We aimed to assess whether a 2-minute delay in the clamping of the umbilical cord of normal-weight, full-term infants improved iron and haematological status up to 6 months of age. 476 mother-infant pairs were recruited at a large obstetrics hospital in Mexico City, Mexico, randomly assigned to delayed clamping (2 min after delivery of the infant's shoulders) or early clamping (around 10 s after delivery), and followed up until 6 months postpartum. Primary outcomes were infant haematological status and iron status at 6 months of age, and analysis was by intention-to-treat. This study is registered with ClinicalTrials.gov, number NCT00298051. 358 (75%) mother-infant pairs completed the trial. At 6 months of age, infants who had delayed clamping had significantly higher mean corpuscular volume (81.0 fL vs 79.5 fL 95% CI -2.5 to -0.6, p=0.001), ferritin (50.7 mug/L vs 34.4 mug/L 95% CI -30.7 to -1.9, p=0.0002), and total body iron. The effect of delayed clamping was significantly greater for infants born to mothers with low ferritin at delivery, breastfed infants not receiving iron-fortified milk or formula, and infants born with birthweight between 2500 g and 3000 g. A cord clamping delay of 2 minutes increased 6-month iron stores by about 27-47 mg. Delay in cord clamping of 2 minutes could help prevent iron deficiency from developing before 6 months of age, when iron-fortified complementary foods could be introduced.",success
29255190,True,"Journal Article;Randomized Controlled Trial;Research Support, Non-U.S. Gov't",,,,,,,,True,"To evaluate the effect and safety of different umbilical cord clamping (UCC) timing. This was a randomized trial of 720 term mothers/infants from the Tianjin Central Hospital of Obstetrics and Gynecology delivered from December 2014 to May 2015 and randomized to immediate cord clamping (ICC) within 15 s, delayed cord clamping (DCC) by 30, 60, 90, 120, 150, or 180 s, or when the umbilical cord pulsation ceased. 24 h after delivery, the mean infant hematocrit levels were 56.5, 57.3, 58.8, 59.7, 59.5, 59.7, 60.3, and 61.0% in the ICC, 30, 60, 90, 120, 150, and 180-second DCC, and no pulsation groups, respectively (P = 0.021, 0.001, 0.003, 0.001, <0.001, and <0.001, respectively; standard deviations ranging 5.4-8.7%). There was no significant difference between the 30-second DCC and ICC groups. No significant differences were found in other neonatal and maternal outcomes among these groups. For term infants, DCC increases the hematocrit values, without apparent harmful effects on the infants and their mothers.",success
30021580,True,Journal Article;Randomized Controlled Trial,,,CTRI 2015/05/005828,,,,,True,"Delayed cord clamping is the standard of care in infants not requiring resuscitation; however effects of cord clamping strategies have not been evaluated systematically in small for gestational age (SGA) infants. The primary objective was to compare effects of delayed cord clamping (DCC) and early cord clamping (ECC) on serum ferritin at 3 months in SGA infants born at ≥35 weeks. The secondary objectives were to compare hematological parameters, clinical outcomes in neonatal period and growth at 3 months of age. All eligible infants with fetal growth restriction were randomized to two groups, DCC at 60 s or ECC group in which the cord was clamped immediately after birth. Total of 142 infants underwent randomization and subsequently 113 infants underwent definite inclusion. At 3 months, the median (IQR) serum ferritin levels were higher in DCC group, compared to ECC; 86 ng/ml (43.35-134.75) vs 50.5 ng/ml (29.5-83.5), p = 0.01. Fewer infants had iron deficiency in DCC group compared to ECC group; 9 (23.6%) vs 21 (47.7%), p = 0.03 [NNT being 4; 95% CI (2-25)].The proportion of infants with polycythemia was significantly higher in DCC group; 23 (41.81) % vs 12 (20.6%), p = 0.01. There was no difference in proportion of infants with symptomatic polycythemia or those who underwent partial exchange transfusions. Clinical outcomes and mortality were similar. DCC improves iron stores in SGA infants ≥35 weeks at 3 months of age without increasing the risk of symptomatic polycythemia, need for partial exchange transfusions or morbidities associated with polycythemia. Our trial was retrospectively registered on 29th May 2015 through Clinical trials registry India. Registration number: CTRI 2015/05/005828 .",success
