ref_pmid,ref_is_clinical_trial_pt_type,ref_publication_types,ref_primary_nct_number,ref_primary_nct_source,ref_all_registry_ids,ref_all_nct_numbers,ref_all_structured_nct_numbers,ref_all_nct_source_pairs,ref_all_structured_nct_source_pairs,ref_has_abstract,ref_abstract,ref_fetch_status
17515864,False,"Journal Article;Research Support, Non-U.S. Gov't",,,,,,,,True,"Despite its use, there is little evidence to support volume infusion (VI) during neonatal cardiopulmonary resuscitation (CPR). This study compares 5% albumin (ALB), normal saline (NS), and no VI (SHAM) on development of pulmonary edema and restoration of mean arterial pressure (MAP) during resuscitation of asphyxiated piglets. Mechanically ventilated swine (n=37, age: 8 +/- 4 d, weight: 2.2 +/- 0.7 kg) were progressively asphyxiated until pH <7.0, Paco2 >100 mm Hg, heart rate (HR) <100 bpm, and MAP <20 mm Hg. After 5 min of ventilatory resuscitation, piglets were randomized blindly to ALB, NS, or SHAM infusion. Animals were recovered for 2 h before euthanasia and lung tissue sampled for wet-to-dry weight ratio (W/D) as a marker of pulmonary edema. SHAM MAP was similar to VI during resuscitation. At 2 h post-resuscitation, MAP of SHAM (48 +/- 13 mm Hg) and ALB (43 +/- 19 mm Hg) was higher than NS (29 +/- 10 mm Hg; p=0.003 and 0.023, respectively). After resuscitation, SHAM piglets had less pulmonary edema (W/D: 5.84 +/- 0.12 versus 5.98 +/- 0.19; p=0.03) and better dynamic compliance (Cd) compared with ALB or NS (Cd: 1.43 +/- 0.69 versus 0.97 +/- 0.37 mL/cm H2O, p=0.018). VI during resuscitation did not improve MAP, and acute recovery of MAP was poorer with NS compared with ALB. VI was associated with increased pulmonary edema. In the absence of hypovolemia, VI during neonatal resuscitation is not beneficial.",success
16533639,False,Journal Article;Review,,,,,,,,True,"Adequate circulating volume to maintain mean arterial blood pressure above a critical value is necessary to reverse bradycardia by positive-pressure ventilation during resuscitation after asphyxia. A variety of circumstances can lead to visible or occult blood loss in the perinatal period; however, distinguishing hypovolemic shock from asphyxial shock can be difficult in the delivery room. Small, randomized, controlled trials support the usefulness of isotonic crystalloid rather than albumin-containing solutions for acute volume expansion; ready availability, lower cost, and lesser risk of infectious complications favor the use of isotonic crystalloid as well. No trials have compared crystalloid and colloid for volume expansion in the setting of immediate resuscitation after birth. Further work is needed to refine the approach to infants in whom adequate positive-pressure ventilation fails and to better discriminate between shock on the basis of hypovolemia versus decreased myocardial function.",success
28739260,False,Journal Article;Review,,,,,,,,True,"Albumin is one of the most abundant proteins in plasma and serves many vital functions. Neonatal concentrations vary greatly with gestational and postnatal age. In critically ill neonates, hypoalbuminemia occurs due to decreased synthesis, increased losses or redistribution of albumin into the extravascular space, and has been associated with increased morbidities and mortality. For that reason, infusion of exogenous albumin as a volume expander has been proposed for various clinical settings including hypotension, delivery room resuscitation, sepsis and postoperative fluid management. Albumin is often prescribed in infants with hypoalbuminemia, hyperbilirubinemia, and protein-losing conditions. However, the evidence of these practices has not been reviewed or validated. Albumin infusion may initiate highly complex processes that vary according to the individual and disease pathophysiology. Indeed, it may be associated with harms when misused. In this review, we critically appraise the scientific evidence for administering albumin in most conditions encountered in the neonatal intensive care unit, while emphasizing the benefits and risks associated with their use.",success
30328174,True,Journal Article;Multicenter Study;Observational Study,,,,,,,,True,"To assess the prevalence, types and indications for fluid bolus therapy in neonates with haemodynamic compromise. This was a pragmatic, international, multicentre observational study in neonatal units across Australasia, Europe and North America with a predefined study period of 10-15 study days per participating neonatal unit between December 2015 and March 2017. Infants ≤28 days of age who received a fluid bolus for the management of haemodynamic compromise (≥10 mL/kg given at ≤6 h) were included. A total of 163 neonates received a bolus over 8479 eligible patient days in 41 neonatal units. Prevalence of fluid bolus therapy varied between centres from 0 to 28.6% of admitted neonates per day, with a pooled prevalence rate of 1.5% (95% confidence interval 1.1-1.9%). The most common fluid used was 0.9% sodium chloride (129/163; 79%), and the volume of fluid administered was most commonly 10 mL/kg (115/163; 71%) over a median of 30 min (interquartile range 20-60). The most frequent indications were hypotension (n = 56; 34%), poor perfusion (n = 20; 12%) and metabolic acidosis (n = 20; 12%). Minimal or no clinical improvement was reported by clinicians in 66 of 163 cases (40%). Wide international variations in types, indications and effects of fluid bolus administration in haemodynamically compromised neonates suggest uncertainty in the risk-benefit profile. This is likely to reflect the lack of robust evidence to support the efficacy of different fluid types, doses and appropriate indications. Together, these highlight a need for further clinically relevant studies.",success
23440789,False,"Journal Article;Meta-Analysis;Research Support, N.I.H., Extramural;Research Support, Non-U.S. Gov't;Systematic Review",,,,,,,,True,"Newborn animal studies and pilot studies in humans suggest that mild hypothermia following peripartum hypoxia-ischaemia in newborn infants may reduce neurological sequelae without adverse effects. To determine the effect of therapeutic hypothermia in encephalopathic asphyxiated newborn infants on mortality, long-term neurodevelopmental disability and clinically important side effects. We used the standard search strategy of the Cochrane Neonatal Review Group as outlined in The Cochrane Library (Issue 2, 2007). Randomised controlled trials evaluating therapeutic hypothermia in term and late preterm newborns with hypoxic ischaemic encephalopathy were identified by searching the Oxford Database of Perinatal Trials, the Cochrane Central Register of Controlled Trials (CENTRAL, The Cochrane Library, 2007, Issue 2), MEDLINE (1966 to June 2007), previous reviews including cross-references, abstracts, conferences, symposia proceedings, expert informants and journal handsearching. We updated this search in May 2012. We included randomised controlled trials comparing the use of therapeutic hypothermia with standard care in encephalopathic term or late preterm infants with evidence of peripartum asphyxia and without recognisable major congenital anomalies. The primary outcome measure was death or long-term major neurodevelopmental disability. Other outcomes included adverse effects of cooling and 'early' indicators of neurodevelopmental outcome. Four review authors independently selected, assessed the quality of and extracted data from the included studies. Study authors were contacted for further information. Meta-analyses were performed using risk ratios (RR) and risk differences (RD) for dichotomous data, and weighted mean difference for continuous data with 95% confidence intervals (CI). We included 11 randomised controlled trials in this updated review, comprising 1505 term and late preterm infants with moderate/severe encephalopathy and evidence of intrapartum asphyxia. Therapeutic hypothermia resulted in a statistically significant and clinically important reduction in the combined outcome of mortality or major neurodevelopmental disability to 18 months of age (typical RR 0.75 (95% CI 0.68 to 0.83); typical RD -0.15, 95% CI -0.20 to -0.10); number needed to treat for an additional beneficial outcome (NNTB) 7 (95% CI 5 to 10) (8 studies, 1344 infants). Cooling also resulted in statistically significant reductions in mortality (typical RR 0.75 (95% CI 0.64 to 0.88), typical RD -0.09 (95% CI -0.13 to -0.04); NNTB 11 (95% CI 8 to 25) (11 studies, 1468 infants) and in neurodevelopmental disability in survivors (typical RR 0.77 (95% CI 0.63 to 0.94), typical RD -0.13 (95% CI -0.19 to -0.07); NNTB 8 (95% CI 5 to 14) (8 studies, 917 infants). Some adverse effects of hypothermia included an increase sinus bradycardia and a significant increase in thrombocytopenia. There is evidence from the 11 randomised controlled trials included in this systematic review (N = 1505 infants) that therapeutic hypothermia is beneficial in term and late preterm newborns with hypoxic ischaemic encephalopathy. Cooling reduces mortality without increasing major disability in survivors. The benefits of cooling on survival and neurodevelopment outweigh the short-term adverse effects. Hypothermia should be instituted in term and late preterm infants with moderate-to-severe hypoxic ischaemic encephalopathy if identified before six hours of age. Further trials to determine the appropriate techniques of cooling, including refinement of patient selection, duration of cooling and method of providing therapeutic hypothermia, will refine our understanding of this intervention.",success
19948631,True,"Journal Article;Multicenter Study;Randomized Controlled Trial;Research Support, N.I.H., Extramural",,,,,,,,True,"The objective of this study was to determine whether Apgar scores at 10 minutes are associated with death or disability in early childhood after perinatal hypoxic-ischemic encephalopathy. This was a secondary analysis of infants who were enrolled in the Eunice Kennedy Shriver National Institute of Child Health and Human Development Neonatal Research Network hypothermia trial. Infants who were born at >or=36 weeks' gestation and had clinical and/or biochemical abnormalities at birth and encephalopathy at <6 hours were studied. Logistic regression and classification and regression-tree analysis were used to determine associations between Apgar scores at 10 minutes and neurodevelopmental outcome, adjusting for covariates. Death or disability (moderate or severe) at 18 to 22 months of age was the measured outcome. Twenty of 208 infants were excluded (missing data). More than 90% of the infants had Apgar scores of 0 to 2 at 1 minute, and Apgar scores at 5 and 10 minutes shifted to progressively higher values; at 10 minutes, 27% of infants had Apgar scores of 0 to 2. After adjustment, each point decrease in Apgar score at 10 minutes was associated with a 45% increase in the odds of death or disability. Death or disability occurred in 76%, 82%, and 80% of infants with 10-minute Apgar scores of 0, 1, and 2, respectively. Classification and regression-tree analysis indicated that Apgar scores at 10 minutes were discriminators of outcome. Apgar scores at 10 minutes provide useful prognostic data before other evaluations are available for infants with hypoxic-ischemic encephalopathy. Death or moderate/severe disability is common but not uniform with Apgar scores of <3; caution is needed before adopting a specific time interval to guide duration of resuscitation.",success
30208498,False,"Comparative Study;Journal Article;Observational Study;Research Support, N.I.H., Extramural",,,,,,,,True,"To determine the short-term outcomes (abnormal brain magnetic resonance imaging [MRI]/death) in infants born with a 10-minute Apgar score of 0 who received therapeutic hypothermia and compare them with infants with higher scores. This is a retrospective review of 293 neonates (gestational age ≥ 35 weeks) born between November 2006 and October 2015 admitted with hypoxic-ischemic encephalopathy who received therapeutic hypothermia. Results of brain MRIs were assessed by the basal ganglia/watershed scoring system. Short-term outcomes were compared between infants with Apgar scores of 0, 1 to 4, and ≥5 at 10 minutes. Eight of 17 infants (47%) with an Apgar of 0 at 10 minutes survived, having 4 (24%) without abnormalities on the brain MRI and 7 (41%) without severe abnormalities. There was no significant difference in the combined outcomes of ""death/abnormal MRI"" and ""death/severe abnormalities on the MRI"" between infants with Apgar scores of 0 and 1 to 4. Follow-up data were available for six of eight surviving infants, and none had moderate or severe neurodevelopmental impairment. In the cooling era, 47% of infants with no audible heart rate at 10 minutes and who were admitted to the neonatal intensive care unit survived; 24% without abnormalities on the brain MRI and 41% without severe abnormalities.",success
25342246,False,Journal Article;Review,,,,,,,,True,"Asystole at birth and extending through 10 min is rare, with current international recommendations stating it may be appropriate to consider discontinuation of resuscitation in this clinical scenario. These recommendations are based on small case series of both term and preterm infants, where death or abnormal outcome was nearly universal. Study objective was to determine recent outcome of infants with an Apgar score of 0 at 10 min despite cardiopulmonary resuscitation, treated with therapeutic hypothermia or standard treatment, in randomised cooling studies. Outcome studies of infants with an Apgar of 0 at 10 min subsequently resuscitated and treated with hypothermia or standard treatment were reviewed and combined with local outcome data of infants treated with hypothermia. Four recent studies (n=81) and local data (n=9) yielded a total of 90 infants with an Apgar of 0 at 10 min, with 56 treated with hypothermia and 34 controls. Primary outcome of death or abnormal neurodevelopmental outcome (18-24 months) occurred in 73% cooled and 79.5% normothermic infants (p=0.61). Although poor, the outcome for infants with an Apgar of 0 at 10 min of life has improved substantially in recent years. This may be related to treatment with hypothermia, enhanced resuscitation techniques and/or other supportive management. Current recommendations to consider discontinuation of resuscitation without a detectable heart rate at 10 min should consider these findings.",success
17466703,False,Journal Article;Systematic Review,,,,,,,,True,"The purpose of this study was to investigate the outcomes of infants who had Apgar scores of zero at 10 minutes and were resuscitated successfully. The literature was reviewed systematically to identify the outcomes of cases; in addition, the perinatal database at the John Radcliffe Hospital, Oxford, was used to identify similar cases. Eligible infants were identified through hospital records, and outcomes of all infants with an Apgar score of zero at 10 minutes, who were born between January 1991 and December 2004, were reviewed. Eighty-five cases were identified from the literature. With the Oxford database, 9 of 83,065 infants (0.12/1000 births) met our study criteria. Six of the 9 infants died before leaving hospital. One infant with severe quadriparesis and microcephaly died at 11 months of age. One infant at follow-up examination at 5 years had severe spastic quadriparesis with severe global delay. One infant with grade 2 hypoxic-ischemic encephalopathy, who was born with severe anemia that was corrected promptly at birth, had mild disability at follow-up examination at 2 years. Thus, death or severe disability occurred in 8 of 9 infants. Combining the results of metaanalysis of published data with our results of 94 infants, 88 infants (94%) either died or were handicapped severely; 2 infants (2%) were handicapped moderately, and 1 infant (1%) was handicapped mildly. For 3 infants (3%), the long-term outcome could not be determined. The outcome of infants with an Apgar score of zero at 10 minutes is almost universally poor.",success
21930284,False,"Journal Article;Research Support, N.I.H., Extramural",,,,,,,,True,"To determine whether delivery room cardiopulmonary resuscitation (DR-CPR) independently predicts morbidities and neurodevelopmental impairment (NDI) in extremely low birth weight infants. We conducted a cohort study of infants born with birth weight of 401 to 1000 g and gestational age of 23 to 30 weeks. DR-CPR was defined as chest compressions, medications, or both. Logistic regression was used to determine associations among DR-CPR and morbidities, mortality, and NDI at 18 to 24 months of age (Bayley II mental or psychomotor index <70, cerebral palsy, blindness, or deafness). Data are adjusted ORs with 95% CIs. Of 8685 infants, 1333 (15%) received DR-CPR. Infants who received DR-CPR had lower birth weight (708±141 g versus 764±146g, P<.0001) and gestational age (25±2 weeks versus 26±2 weeks, P<.0001). Infants who received DR-CPR had more pneumothoraces (OR, 1.28; 95% CI, 1.48-2.99), grade 3 to 4 intraventricular hemorrhage (OR, 1.47; 95% CI, 1.23-1.74), bronchopulmonary dysplasia (OR, 1.34; 95% CI, 1.13-1.59), death by 12 hours (OR, 3.69; 95% CI, 2.98-4.57), and death by 120 days after birth (OR, 2.22; 95% CI, 1.93-2.57). Rates of NDI in survivors (OR, 1.23; 95% CI, 1.02-1.49) and death or NDI (OR, 1.70; 95% CI, 1.46-1.99) were higher for DR-CPR infants. Only 14% of DR-CPR recipients with 5-minute Apgar score <2 survived without NDI. DR-CPR is a prognostic marker for higher rates of mortality and NDI for extremely low birth weight infants. New DR-CPR strategies are needed for this population.",success
15286217,False,Journal Article,,,,,,,,True,"To determine the potential contribution of initial hypoglycemia to the development of neonatal brain injury in term infants with severe fetal acidemia. A retrospective chart review was conducted of 185 term infants who were admitted to the neonatal intensive care unit between January 1993 and December 2002 with an umbilical arterial pH <7.00. Short-term neurologic outcome measures include death as a consequence of severe encephalopathy and evidence of moderate to severe encephalopathy with or without seizures. Hypoglycemia was defined as an initial blood glucose < or =40 mg/dL. Forty-one (22%) infants developed an abnormal neurologic outcome, including 14 (34%) with severe hypoxic ischemic encephalopathy who died, 24 (59%) with moderate to severe hypoxic ischemic encephalopathy, and 3 (7%) with seizures. Twenty-seven (14.5%) of the 185 infants had an initial blood sugar < or =40 mg/dL. Fifteen (56%) of 27 infants with a blood sugar < or =40 mg/dL versus 26 (16%) of 158 infants with a blood sugar >40 mg/dL had an abnormal neurologic outcome (odds ratio [OR]: 6.3; 95% confidence interval [CI]: 2.6-15.3). Infants with abnormal outcomes and a blood sugar < or =40 mg/dL versus >40 mg/dL had a higher pH (6.86 +/- 0.07 vs 6.75 +/- 0.09), a lesser base deficit (-19 +/- 4 vs -23.8 +/- 4 mEq/L), and lower mean arterial blood pressure (34 +/- 10 vs 45 +/- 14 mm Hg), respectively. There was no difference between groups in the proportion of infants who required cardiopulmonary resuscitation (7 [46%] vs 15 [57%]) and those with a 5-minute Apgar score <5 (11 [73%] vs 22 [85%]). By multivariate logistic analysis, 4 variables were significantly associated with abnormal outcome: initial blood glucose < or =40 mg/dL versus >40 mg/dL (OR: 18.5; 95% CI: 3.1-111.9), cord arterial pH < or =6.90 versus >6.90 (OR: 9.8; 95% CI: 2.1-44.7), a 5-minute Apgar score < or =5 versus >5 (OR: 6.4; 95% CI: 1.7-24.5), and the requirement for intubation with or without cardiopulmonary resuscitation versus neither (OR: 4.7; 95% CI: 1.2-17.9). Initial hypoglycemia is an important risk factor for perinatal brain injury, particularly in depressed term infants who require resuscitation and have severe fetal acidemia. It remains unclear, however, whether earlier detection of hypoglycemia, such as in the delivery room, in this population could modify subsequent neurologic outcome.",success
24472882,False,Journal Article,,,,,,,,True,"A term borrowed from emergency and cardiovascular medicine, the phrase ""Golden Hour"" refers to the first hour of an infant's life following delivery. The impact of implementation of a Golden Hour Protocol in a level III neonatal intensive care unit (NICU) for infants delivered at less than 28 weeks gestation was examined, with a focus on admission temperature, admission glucose, and time to the initiation of an intravenous glucose and amino acid administration. As part of a quality initiative project, data were collected before and after the implementation of the Golden Hour Protocol for infants born at less than 28 weeks gestational age from May 2008 through December 2011. Desired outcomes were admission axillary temperature within a range of 36.5°C to 37.4°C, admission glucose more than 50 mg/dL, and the initiation of a glucose and amino acid infusion within 1 hour of birth. Key components of the Golden Hour included the use of a protocolized script, which clearly defined the roles of the delivery room personnel, placing the infant in a polyethylene bag to prevent heat loss, the application of the isolette skin temperature probe within 10 minutes of age, and insertion of umbilical catheters before moving the infant from the resuscitation area to the NICU. Data were collected on 225 infants born less than 28 weeks gestation: 106 in the preprotocol group and 119 in the postprotocol group. Differences between the 2 groups were not statistically significant for birth weight and gestational age. There was a statistically significant difference in the number of infants with an admission temperature in-range (36.5°C-37.4°C) between the preprotocol and postprotocol infants (28.3% vs 49.6%; P = .002). There was a statistically significant difference in the incidence of admission glucose greater than 50 mg/dL between the pre- and postprotocol groups (55.7% vs 72%; P = .012). There was a highly statistically significant difference in the number of post-Golden Hour Protocol infants who received an intravenous administration of glucose and amino acids within 1 hour of life compared with the preprotocol group (61.3% vs 7%; P = 0.001). Our results suggest that the implementation of the Golden Hour Protocol can significantly improve the stabilization of infants delivered less than 28 weeks gestation.",success
21294901,False,"Journal Article;Research Support, Non-U.S. Gov't",,,,,,,,True,"To examine the blood glucose profile and the relationship between blood glucose levels and neurodevelopmental outcome in term infants with hypoxic-ischaemic encephalopathy. Blood glucose values within 72 hours of birth were collected from 52 term infants with hypoxic-ischaemic encephalopathy. Hypoglycaemia [< 46.8 mg/dL (2.6 mmol/L)] and hyperglycaemia [> 150 mg/dL (8.3 mmol/L)] were correlated to neurodevelopmental outcome at 24 months of age. Four fifths of the 468 blood samples were in the normoglycaemic range (392/468:83.8%). Of the remaining 76 samples, 51.3% were in the hypoglycaemic range and (48.7%) were hyperglycaemic. A quarter of the hypoglycaemic samples (28.2%:11/39) and a third of the hyperglycaemic samples (32.4%:12/37) were recorded within the first 30 minutes of life. Mean (SD) blood glucose values did not differ between infants with normal and abnormal outcomes [4.89(2.28) mmol/L and 5.02(2.35) mmol/L, p value = 0.15] respectively. In term infants with hypoxic-ischaemic encephalopathy, early hypoglycaemia (between 0-6 hours of life) was associated with adverse outcome at 24 months of age [OR = 5.8, CI = 1.04-32)]. On multivariate analysis to adjust for grade of HIE this association was not statistically significant. Late hypoglycaemia (6-72 hours of life) was not associated with abnormal outcome [OR = 0.22, CI (0.04-1.14)]. The occurrence of hyperglycaemia was not associated with adverse outcome. During the first 72 hours of life, blood glucose profile in infants with hypoxic-ischaemic encephalopathy varies widely despite a management protocol. Early hypoglycaemia (0-6 hours of life) was associated with severe HIE, and thereby; adverse outcome.",success
