ref_pmid,ref_is_clinical_trial_pt_type,ref_publication_types,ref_primary_nct_number,ref_primary_nct_source,ref_all_registry_ids,ref_all_nct_numbers,ref_all_structured_nct_numbers,ref_all_nct_source_pairs,ref_all_structured_nct_source_pairs,ref_has_abstract,ref_abstract,ref_fetch_status
31070944,False,Journal Article,,,,,,,,True,"Two distinct pathways can lead to functional mitral regurgitation (MR) in patients with chronic heart failure and a reduced ejection fraction. When remodeling and enlargement of the left ventricle (LV) cause annular dilatation and tethering of the mitral valve leaflets, there is a linear relationship between LV end-diastolic volume and the effective regurgitant orifice area of the mitral valve. These patients, designated as having proportionate MR, respond favorably to treatments that lead to reversal of LV remodeling and a decrease in LV volumes (eg, neurohormonal antagonists and LV assist devices), but they may not benefit from interventions that are directed only at the mitral valve leaflets (eg, transcatheter mitral valve repair). In contrast, when ventricular dyssynchrony causes functional MR attributable to unequal contraction of the papillary muscles, the magnitude of regurgitation is greater than that predicted by LV volumes. These patients, designated as having severe but disproportionate MR, respond favorably to treatments that are directed to the mitral valve leaflets or their supporting structures (eg, cardiac resynchronization or transcatheter mitral valve repair), but they may derive little benefit from interventions that act only to reduce LV cavity size (eg, pharmacological treatments). This novel conceptual framework reflects the important interplay between LV geometry and mitral valve function in determining the clinical presentation of patients, and it allows characterization of the determinants of functional MR to guide the most appropriate therapy in the clinical setting.",success
30553663,False,"Journal Article;Research Support, Non-U.S. Gov't;Review",,,,,,,,True,"Traditional approaches to the characterization of secondary or functional mitral regurgitation (MR) have largely ignored the critical importance of the left ventricle (LV). We propose that patients with secondary MR represent a heterogenous group, which can be usefully subdivided based on understanding that the effective regurgitant orifice area (EROA) is dependent on left ventricular end-diastolic volume (LVEDV). According to the Gorlin hydraulic orifice equation, patients with heart failure, an LV ejection fraction of 30%, an LVEDV of 220 to 250 ml, and a regurgitant fraction of 50% would be expected to have an EROA of ≈0.3 cm<sup>2</sup> independent of specific tethering abnormalities of the mitral valve leaflets. The MR in these patients is proportionate to the degree of LV dilatation and can respond to drugs and devices that reduce LVEDV. In contrast, patients with EROA of 0.3 to 0.4 cm<sup>2</sup> but with LVEDV of only 160 to 200 ml exhibit degrees of MR that are disproportionately higher than predicted by LVEDV. These patients appear to preferentially benefit from interventions directed at the mitral valve. Our proposed conceptual framework explains the apparently discordant results from 2 recent randomized controlled trials of mitral valve repair. The MITRA-FR (Percutaneous Repair with the MitraClip Device for Severe Functional/Secondary Mitral Regurgitation) trial enrolled patients who had MR that was proportionate to the degree of LV dilatation, and during long-term follow-up, the LVEDV and clinical outcomes of these patients did not differ from medically-treated control subjects. In comparison, the patients enrolled in the COAPT (Cardiovascular Outcomes Assessment of the MitraClip Percutaneous Therapy for Heart Failure Patients with Functional Mitral Regurgitation) trial had an EROA ≈30% higher but LV volumes that were ≈30% smaller, indicative of disproportionate MR. In these patients, transcatheter mitral valve repair reduced the risk of death and hospitalization for heart failure, and these benefits were paralleled by a meaningful decrease in LVEDV. Thus, characterization of MR as proportionate or disproportionate to LVEDV appears to be critical to the selection of an optimal treatment for patients with chronic heart failure and systolic dysfunction.",success
21803543,False,Comparative Study;Journal Article,,,,,,,,True,"Identification of mitral regurgitation (MR) mechanism and pathology are crucial for surgical repair. The aim of the present investigation was to evaluate the comparative accuracy of real-time three-dimensional (3D) transesophageal echocardiography (TEE) and transthoracic echocardiography (TTE) with two-dimensional (2D) TEE and TTE in diagnosing the mechanism of MR compared with the surgical standard. Forty patients referred for surgical mitral valve repair were studied; 2D and 3D echocardiography with both TTE and TEE were performed preoperatively. Two independent observers reviewed the studies for MR pathology, functional or organic. In organic disease, the presence and localization of leaflet prolapse and/or flail were noted. Surgical findings served as the gold standard. There was 100% agreement in identifying functional versus organic MR among all four modalities. Overall, 2D TTE, 2D TEE, and 3D TEE performed similarly in identifying a prolapse or a flail leaflet; 3D TEE had the best agreement in identifying anterior leaflet prolapse, and it also showed an advantage for segmental analysis. Three-dimensional TTE was less sensitive and less accurate in identifying flail segments. All modalities were equally reliable in identifying functional MR. Both 2D TEE and 3D TEE were comparable in diagnosing MR mechanism, while 3D TEE had the advantage of better localizing the disease. With current technology, 3D TTE was the least reliable in identifying valve pathology.",success
23953703,False,Journal Article;Review,,,,,,,,True,"Ischemic mitral regurgitation (MR) is a common complication of myocardial infarction thought to result from leaflet tethering caused by displacement of the papillary muscles that occurs as the left ventricle remodels. The author explores the possibility that left atrial remodeling may also play a role in the pathogenesis of ischemic MR, through a novel mechanism: atriogenic leaflet tethering. When ischemic MR is hemodynamically significant, the left ventricle compensates by dilating to preserve forward output using the Starling mechanism. Left ventricular dilatation, however, worsens MR by increasing the mitral valve regurgitant orifice, leading to a vicious cycle in which MR begets more MR. The author proposes that several structural adaptations play a role in reducing ischemic MR. In contrast to the compensatory effects of left ventricular enlargement, these may reduce, rather than increase, its severity. The suggested adaptations involve the mitral valve leaflets, the papillary muscles, the mitral annulus, and the left ventricular false tendons. This review describes the potential role each may play in reducing ischemic MR. Therapies that exploit these adaptations are also discussed.",success
22223695,False,Evaluation Study;Journal Article,,,,,,,,True,"Feasibility of mitral repair is a key factor in the decision to operate for mitral regurgitation. Repair feasibility is highly dependent on surgical experience and repair complexity. We sought an objective means of predicting complexity of repair using three-dimensional (3D) transoesophageal echocardiography. In a cohort of 786 patients who underwent mitral valve surgery between 2007 and 2010, 3D transoesophageal echocardiography was performed in 66 patients with mitral regurgitation prior to the institution of cardiopulmonary bypass. The surgeon reviewed the 2D echocardiographic images for all patients pre-operatively, but did not view the 3D echocardiographic quantitative data or volumetric analysis until after surgery. Repairs involving no or a single-segment leaflet resection, sliding-plasty, cleft closure, chordal or commissural repair techniques were classed as standard repairs. Complex repairs were defined as those involving bileaflet repair techniques, requiring multiple resections or patch augmentation. Disease aetiology included Barlow's disease (n = 18), fibroelastic deficiency (n = 22), ischaemic (n = 5), endocarditis (n = 5), rheumatic (n = 2) and dilated cardiomyopathy (n = 2). No patient required mitral replacement or had more than mild mitral regurgitation on pre-discharge echocardiography. Anterior and posterior leaflet areas, annular circumference, anterior and posterior leaflet angles, prolapse and tenting heights and volumes were most strongly predictive of repair complexity. As 21 of the 22 patients with bileaflet pathology and multisegment prolapse were complex repairs, we sought to develop a model predicting repair complexity in the remaining patients. The most predictive model with a c-statistic of 0.91 included three predictors: multisegment pathology, prolapsing height and posterior leaflet angle. After bootstrap validation, the revised c-statistic was 0.88. 3D transoesophageal echocardiography provides an objective means of predicting mitral repair complexity in mitral regurgitation due to a range of aetiology.",success
22032703,False,Journal Article;Review,,,,,,,,True,"Significant advances in 3-dimensional echocardiography (3DE) technology have ushered its use into clinical practice. The recent advent of real-time 3DE using matrix array transthoracic and transesophageal transducers has resulted in improved image spatial resolution, and therefore, enhanced visualization of the pathomorphological features of the cardiac valves compared with previously used sparse array transducers. It has enabled an unparalleled real-time visualization of valves and subvalvular anatomic features from a single volume acquisition without the need for offline reconstruction. On-cart or offline post-processing using commercially available and custom 3-dimensional analysis software allows the quantification of multiple parameters, such as orifice area, prolapse height and volume in mitral valve disease, area of the left ventricular outflow tract, and tricuspid annular geometry. In this review, we discuss the incremental role of 3DE in evaluating valvular anatomic features, volumetric quantification, pre-surgical planning, intraprocedural guidance, and post-procedural assessment of valvular heart disease.",success
25559473,False,Journal Article,,,,,,,,True,"The rapid technological developments of the past decade and the changes in echocardiographic practice brought about by these developments have resulted in the need for updated recommendations to the previously published guidelines for cardiac chamber quantification, which was the goal of the joint writing group assembled by the American Society of Echocardiography and the European Association of Cardiovascular Imaging. This document provides updated normal values for all four cardiac chambers, including three-dimensional echocardiography and myocardial deformation, when possible, on the basis of considerably larger numbers of normal subjects, compiled from multiple databases. In addition, this document attempts to eliminate several minor discrepancies that existed between previously published guidelines.",success
16061756,False,"Journal Article;Research Support, N.I.H., Extramural;Research Support, Non-U.S. Gov't;Research Support, U.S. Gov't, P.H.S.;Review",,,,,,,,False,,success
24035166,False,"Journal Article;Research Support, N.I.H., Extramural",,,,,,,,True,"The mechanisms underlying functional mitral regurgitation (MR) and the relation between mechanism and severity of MR have not been evaluated in a large, multicenter, randomized controlled trial. Transesophageal echocardiography (TEE) was performed in 215 patients at 17 centers in the Surgical Treatment for Ischemic Heart Failure (STICH) trial. Both 2-dimensional (n = 215) and 3-dimensional (n = 81) TEEs were used to assess multiple quantitative measurements of the mechanism and severity of MR. By 2-dimensional TEE, leaflet tenting area, anterior and posterior leaflet angles, mitral annulus diameter, left ventricular (LV) end-systolic volume index, LV ejection fraction (LVEF), and sphericity index (p <0.05 for all) were significantly different across MR grades. By 3-dimensional TEE, mitral annulus area, leaflet tenting area, LV end-systolic volume index, LVEF, and sphericity index (p <0.05 for all) were significantly different across MR grades. A multivariate analysis showed a trend for annulus area (p = 0.069) and LV end-systolic volume index (p = 0.071) to predict effective regurgitant orifice area and for annulus area (p = 0.018) and LV end-systolic volume index (p = 0.073) to predict vena contracta area. In the STICH trial, multiple quantitative parameters of the mechanism of functional MR are related to MR severity. The mechanism of functional MR in ischemic cardiomyopathy is heterogeneous, but no single variable stands out as a strong predictor of quantitative severity of MR.",success
21939832,False,"Comparative Study;Journal Article;Research Support, Non-U.S. Gov't",,,,,,,,True,"The purpose of this study was to determine whether atrial fibrillation (AF) might cause significant mitral regurgitation (MR), and to see whether this MR improves with restoration of sinus rhythm. MR can be classified by leaflet pathology (organic/primary and functional/secondary) and by leaflet motion (normal, excessive, restrictive). The existence of secondary, normal leaflet motion MR remains controversial. We performed a retrospective cohort study. Patients undergoing first AF ablation at our institution (n = 828) were screened. Included patients had echocardiograms at the time of ablation and at 1-year clinical follow-up. The MR cohort (n = 53) had at least moderate MR. A reference cohort (n = 53) was randomly selected from those patients (n = 660) with mild or less MR. Baseline echocardiographic and clinical characteristics were compared, and the effect of restoration of sinus rhythm was assessed by follow-up echocardiograms. MR patients were older than controls and more often had persistent AF (62% vs. 23%, p < 0.0001). MR patients had larger left atria (volume index: 32 cm(3)/m(2) vs. 26 cm(3)/m(2), p = 0.008) and annular size (3.49 cm vs. 3.23 cm, p = 0.001), but similar left ventricular size and ejection fraction. Annular size, age and persistent AF were independently associated with MR. On follow-up echocardiogram, patients in continuous sinus rhythm had greater reductions in left atrial size and annular dimension, and lower rates of significant MR (24% vs. 82%, p = 0.005) compared with those in whom sinus rhythm was not restored. AF can result in ""atrial functional MR"" that improves if sinus rhythm is restored.",success
23942679,True,"Comparative Study;Journal Article;Multicenter Study;Research Support, Non-U.S. Gov't",,,,,,,,True,"The optimal management of severe mitral valve regurgitation in patients without class I triggers (heart failure symptoms or left ventricular dysfunction) remains controversial in part due to the poorly defined long-term consequences of current management strategies. In the absence of clinical trial data, analysis of large multicenter registries is critical. To ascertain the comparative effectiveness of initial medical management (nonsurgical observation) vs early mitral valve surgery following the diagnosis of mitral regurgitation due to flail leaflets. The Mitral Regurgitation International Database (MIDA) registry includes 2097 consecutive patients with flail mitral valve regurgitation (1980-2004) receiving routine cardiac care from 6 tertiary centers (France, Italy, Belgium, and the United States). Mean follow-up was 10.3 years and was 98% complete. Of 1021 patients with mitral regurgitation without the American College of Cardiology (ACC) and the American Heart Association (AHA) guideline class I triggers, 575 patients were initially medically managed and 446 underwent mitral valve surgery within 3 months following detection. Association between treatment strategy and survival, heart failure, and new-onset atrial fibrillation. There was no significant difference in early mortality (1.1% for early surgery vs 0.5% for medical management, P=.28) and new-onset heart failure rates (0.9% for early surgery vs 0.9% for medical management, P=.96) between treatment strategies at 3 months. In contrast, long-term survival rates were higher for patients with early surgery (86% vs 69% at 10 years, P < .001), which was confirmed in adjusted models (hazard ratio [HR], 0.55 [95% CI, 0.41-0.72], P < .001), a propensity-matched cohort (32 variables; HR, 0.52 [95% CI, 0.35-0.79], P = .002), and an inverse probability-weighted analysis (HR, 0.66 [95% CI, 0.52-0.83], P < .001), associated with a 5-year reduction in mortality of 52.6% (P < .001). Similar results were observed in relative reduction in mortality following early surgery in the subset with class II triggers (59.3 after 5 years, P = .002). Long-term heart failure risk was also lower with early surgery (7% vs 23% at 10 years, P < .001), which was confirmed in risk-adjusted models (HR, 0.29 [95% CI, 0.19-0.43], P < .001), a propensity-matched cohort (HR, 0.44 [95% CI, 0.26-0.76], P = .003), and in the inverse probability-weighted analysis (HR, 0.51 [95% CI, 0.36-0.72], P < .001). Reduction in late-onset atrial fibrillation was not observed (HR, 0.85 [95% CI, 0.64-1.13], P = .26). Among registry patients with mitral valve regurgitation due to flail mitral leaflets, performance of early mitral surgery compared with initial medical management was associated with greater long-term survival and a lower risk of heart failure, with no difference in new-onset atrial fibrillation.",success
16423672,True,Controlled Clinical Trial;Journal Article,,,,,,,,True,"We sought to investigate the 3-dimensional geometric differences of mitral leaflet tenting in ischemic mitral regurgitation, comparing inferior and anterior myocardial infarction (MI). Using real-time 3-dimensional echocardiography, we obtained transthoracic volumetric images for patients with significant ischemic mitral regurgitation (9 inferior and 7 anterior). With our novel software system, 3-dimensional images of the leaflets were reconstructed for quantitation. Mitral leaflet configuration was then represented in contour in which the degree of the tenting could be observed. Calculated percent of tethered leaflet area (>5-mm tenting from the annular level) was compared in inferior and anterior MI. Percent of tethered leaflet area was significantly smaller in inferior than anterior MI, reflecting the localized leaflet tenting in inferior MI (16.7 +/- 18.8% vs 38.9 +/- 9.7%, P = .01). In anterior MI, mitral valve leaflets were widely tethered toward the left ventricle, in contrast with inferior MI showing localized tenting of the leaflet.",success
25790878,True,"Clinical Trial;Comparative Study;Journal Article;Multicenter Study;Research Support, Non-U.S. Gov't",,,,,,,,True,"The decision to undergo mitral valve surgery is often made on the basis of echocardiographic criteria and clinical assessment. Recent changes in treatment guidelines recommending surgery in asymptomatic patients make the accurate assessment of mitral regurgitation (MR) severity even more important. The purpose of this study was to compare echocardiography and magnetic resonance imaging (MRI) in the assessment of MR severity using the degree of left ventricular (LV) remodeling after surgery as the reference standard. In this prospective multicenter trial, MR severity was assessed in 103 patients using both echocardiography and MRI. Thirty-eight patients subsequently had isolated mitral valve surgery, and 26 of these had an additional MRI performed 5 to 7 months after surgery. The pre-surgical estimate of regurgitant severity was correlated with the postoperative decrease in LV end-diastolic volume. Agreement between MRI and echocardiographic estimates of MR severity was modest in the overall cohort (r = 0.6; p < 0.0001), and there was a poorer correlation in the subset of patients sent for surgery (r = 0.4; p = 0.01). There was a strong correlation between post-surgical LV remodeling and MR severity as assessed by MRI (r = 0.85; p < 0.0001), and no correlation between post-surgical LV remodeling and MR severity as assessed by echocardiography (r = 0.32; p = 0.1). The data suggest that MRI is more accurate than echocardiography in assessing the severity of MR. MRI should be considered in those patients when MR severity as assessed by echocardiography is influencing important clinical decisions, such as the decision to undergo MR surgery.",success
3049740,False,Journal Article,,,,,,,,True,"Major clinical uses of the new Doppler color flow mapping technologies involve the imaging of disturbed flow through cardiac defects or valves. Nevertheless, there is little general understanding of the determinants of flow and of how flow is imaged by these new systems. This review will attempt to relate the hydrodynamics through a simplified stenotic or regurgitant orifice with the physics and sampling theories relevant to the functioning of Doppler color flow mapping systems. The goal will be to characterize the velocity resolution, spatial resolution, sensitivity and performance of these systems so that clinicians can understand why flow looks the way it does on Doppler color studies and which aspects of flow mapping can be expected to become more quantifiable than they are at present.",success
20435783,False,Journal Article;Practice Guideline,,,,,,,,True,"Mitral and tricuspid are increasingly prevalent. Doppler echocardiography not only detects the presence of regurgitation but also permits to understand mechanisms of regurgitation, quantification of its severity and repercussions. The present document aims to provide standards for the assessment of mitral and tricuspid regurgitation.",success
22388325,True,"Comparative Study;Journal Article;Randomized Controlled Trial;Research Support, Non-U.S. Gov't",,,,,,,,True,"Mitral regurgitation (MR) of mitral valve prolapse predominates in late systole but may be holosystolic or purely mid-late systolic, but the impact of MR timing on MR left ventricular and left atrial consequences and outcome is unknown. Whether effective regurgitant orifice (ERO) by the flow convergence method is similarly linked to outcome in mid-late systolic MR and holosystolic MR is uncertain. We comprehensively and prospectively quantified MR in 111 patients with mitral valve prolapse and mid-late systolic MR and matched them to 90 patients with mitral valve prolapse and holosystolic MR for age, gender, atrial fibrillation, ejection fraction, and ERO (flow convergence). Mid-late systolic MR versus holosystolic MR groups were well matched, including for comorbidity, blood pressure, and heart rate (all P>0.10). Mid-late systolic MR versus holosystolic MR caused similar color jet area, midsystolic regurgitant flow, and peak velocity (P>0.40). Despite identical ERO (0.25±0.15 versus 0.25±0.15 cm(2); P=0.53), the shorter duration of mid-late systolic MR (233±56 versus 426±50 ms; P<0.0001) yielded lower regurgitant volume (24.8±13.4 versus 48.6±25.6 mL; P<0.0001). MR consequences, systolic pulmonary pressure, and left ventricular and left atrial volume index (all P<0.001) were more benign in mid-late systolic MR versus holosystolic MR. Under medical management, fewer cardiac events (5 years: 15.8±4.6% versus 40.4±6.1%; P<0.0001) occurred in mid-late systolic MR versus holosystolic MR, requiring less mitral surgery. Multivariable analysis confirmed the independent association of mid-late systolic MR with benign consequences and outcomes (all P<0.01). Absolute ERO was not linked to outcome, in contrast to regurgitant volume. MR of mitral valve prolapse that is purely mid-late systolic causes more benign consequences and outcomes than holosystolic MR. Assessment may be misleading because jet area and ERO by flow convergence appear similar to those of holosystolic MR. However, shorter MR yields lower regurgitant volume, consequences, and benign outcomes. Instantaneous ERO by flow convergence should be interpreted in context, and in mid-late systolic MR, regurgitant volume provides information more reflective of MR severity. Therefore, for clinical management and surgical referral, clinicians should carefully take into account the timing and consequences of MR.",success
